{"budget":{"budgetVersion":"minecraft-palette-budget-v1","estimatedRetainedBytes":8640,"mappingCount":18,"maximumCanonicalBytes":65536,"maximumPaletteRetainedBytes":16777216,"maximumPaletteSize":16384},"canonicalChecksum":"b06d75003fa999cc8df5ed5d68f87b43d8d299cb45b5096eceae94cca0a99127","catalog":{"budget":{"budgetVersion":"minecraft-palette-catalog-budget-v1","maximumCanonicalBytes":32768,"maximumDistinctBlockStates":16,"maximumMappings":18},"catalogContractVersion":"builtin-minecraft-palette-catalog-v1","catalogId":"landformcraft.builtin-minecraft-palette","catalogVersion":1,"mappings":[{"aspect":"CEILING","blockState":"minecraft:stone","classCode":1,"classId":"material.host-rock-exposed","kind":"HOST_ROCK_EXPOSED"},{"aspect":"FLOOR","blockState":"minecraft:stone","classCode":1,"classId":"material.host-rock-exposed","kind":"HOST_ROCK_EXPOSED"},{"aspect":"SURFACE","blockState":"minecraft:stone","classCode":1,"classId":"material.host-rock-exposed","kind":"HOST_ROCK_EXPOSED"},{"aspect":"CEILING","blockState":"minecraft:cobblestone","classCode":2,"classId":"material.host-rock-wet","kind":"HOST_ROCK_WET"},{"aspect":"FLOOR","blockState":"minecraft:cobblestone","classCode":2,"classId":"material.host-rock-wet","kind":"HOST_ROCK_WET"},{"aspect":"SURFACE","blockState":"minecraft:cobblestone","classCode":2,"classId":"material.host-rock-wet","kind":"HOST_ROCK_WET"},{"aspect":"CEILING","blockState":"minecraft:dirt","classCode":3,"classId":"material.sediment-exposed","kind":"SEDIMENT_EXPOSED"},{"aspect":"FLOOR","blockState":"minecraft:gravel","classCode":3,"classId":"material.sediment-exposed","kind":"SEDIMENT_EXPOSED"},{"aspect":"SURFACE","blockState":"minecraft:sand","classCode":3,"classId":"material.sediment-exposed","kind":"SEDIMENT_EXPOSED"},{"aspect":"CEILING","blockState":"minecraft:mud","classCode":4,"classId":"material.sediment-wet","kind":"SEDIMENT_WET"},{"aspect":"FLOOR","blockState":"minecraft:mud","classCode":4,"classId":"material.sediment-wet","kind":"SEDIMENT_WET"},{"aspect":"SURFACE","blockState":"minecraft:mud","classCode":4,"classId":"material.sediment-wet","kind":"SEDIMENT_WET"},{"aspect":"CEILING","blockState":"minecraft:stone","classCode":5,"classId":"material.snow-covered-rock","kind":"SNOW_COVERED_ROCK"},{"aspect":"FLOOR","blockState":"minecraft:stone","classCode":5,"classId":"material.snow-covered-rock","kind":"SNOW_COVERED_ROCK"},{"aspect":"SURFACE","blockState":"minecraft:snow_block","classCode":5,"classId":"material.snow-covered-rock","kind":"SNOW_COVERED_ROCK"},{"aspect":"CEILING","blockState":"minecraft:dirt","classCode":6,"classId":"material.snow-covered-sediment","kind":"SNOW_COVERED_SEDIMENT"},{"aspect":"FLOOR","blockState":"minecraft:gravel","classCode":6,"classId":"material.snow-covered-sediment","kind":"SNOW_COVERED_SEDIMENT"},{"aspect":"SURFACE","blockState":"minecraft:snow_block","classCode":6,"classId":"material.snow-covered-sediment","kind":"SNOW_COVERED_SEDIMENT"}]},"compatibility":{"compatibilityContractVersion":"minecraft-palette-compatibility-v1","dataVersion":4671,"minecraftVersion":"1.21.11","resolverVersion":"minecraft-palette-resolver-v1"},"materialProfileBinding":{"bindingContractVersion":"minecraft-palette-material-binding-v1","bindingVersion":1,"sourceCatalogId":"landformcraft.builtin-material-profile","sourceCatalogVersion":1,"sourceMaterialProfilePlanChecksum":"95d17a0e2215e6c063cd0dc45b7f2dbf0722e108aca57fe482d7e4699d8a10c8"},"paletteContractVersion":"minecraft-palette-contract-v1","planVersion":1}